{
  "schema_version": 1,
  "packet_id": "FSCI-P2C-002",
  "domain": "linalg",
  "generated_at": "2026-02-14T06:35:00Z",
  "contracts": [
    {
      "function_name": "fsci_linalg::solve",
      "scipy_equivalent": "scipy.linalg.solve",
      "inputs": [
        {
          "name": "a",
          "type_desc": "2D array f64 or c64, shape (N, N)",
          "required": true,
          "constraints": "Must be square. Batch dimensions (..., N, N) supported."
        },
        {
          "name": "b",
          "type_desc": "1D or 2D array f64 or c64, shape (N,) or (N, NRHS)",
          "required": true,
          "constraints": "b.shape[-2] (or b.len() for 1D) must equal a.shape[-1]."
        },
        {
          "name": "assume_a",
          "type_desc": "Option<MatrixAssumption>",
          "required": false,
          "default_value": "None",
          "constraints": "When None, auto-detect structure per-slice. Valid: General, Diagonal, Triangular, Symmetric, Hermitian, PositiveDefinite, Banded, TriDiagonal."
        },
        {
          "name": "lower",
          "type_desc": "bool",
          "required": false,
          "default_value": "false",
          "constraints": "Only meaningful when assume_a is Symmetric, Hermitian, or PositiveDefinite."
        },
        {
          "name": "transposed",
          "type_desc": "bool",
          "required": false,
          "default_value": "false",
          "constraints": "Solve A^T x = b. Not supported for complex matrices (returns error)."
        },
        {
          "name": "check_finite",
          "type_desc": "bool",
          "required": false,
          "default_value": "true",
          "constraints": "When true, reject NaN/Inf inputs."
        }
      ],
      "outputs": [
        {
          "name": "x",
          "type_desc": "Array f64 or c64, same shape as b",
          "semantics": "Solution to Ax = b (or A^T x = b if transposed=true). Shape matches b exactly."
        }
      ],
      "error_conditions": [
        {
          "condition": "a is not square (last two dims differ)",
          "error_type": "InvalidShape",
          "message_pattern": "expected square matrix",
          "scipy_behavior": "ValueError: Expected square matrix"
        },
        {
          "condition": "a.ndim < 2",
          "error_type": "InvalidShape",
          "message_pattern": "expected at least 2D input",
          "scipy_behavior": "ValueError: Expected at least ndim=2"
        },
        {
          "condition": "b row count != a column count",
          "error_type": "IncompatibleShape",
          "message_pattern": "incompatible dimensions",
          "scipy_behavior": "ValueError: incompatible shapes"
        },
        {
          "condition": "matrix is singular (zero pivot in LU)",
          "error_type": "SingularMatrix",
          "message_pattern": "singular matrix",
          "scipy_behavior": "LinAlgError: singular matrix"
        },
        {
          "condition": "invalid assume_a variant",
          "error_type": "InvalidArgument",
          "message_pattern": "unrecognized matrix structure",
          "scipy_behavior": "ValueError: not a recognized matrix structure"
        },
        {
          "condition": "complex input with transposed=true",
          "error_type": "NotSupported",
          "message_pattern": "complex transposed solve not supported",
          "scipy_behavior": "NotImplementedError: can currently not solve a^T x = b"
        },
        {
          "condition": "check_finite=true and input contains NaN or Inf",
          "error_type": "NonFiniteInput",
          "message_pattern": "input contains non-finite values",
          "scipy_behavior": "ValueError: array must not contain infs or NaNs"
        }
      ],
      "tolerance_policy": {
        "comparison_mode": "mixed",
        "default_atol": 1e-12,
        "default_rtol": 1e-8,
        "notes": "Tolerance depends on matrix condition number. For well-conditioned systems (cond < 1e6), atol=1e-12 suffices. For ill-conditioned systems, rtol-based comparison is more appropriate. Backend dispatch (diagonal vs LU vs Cholesky) may produce bit-level differences."
      },
      "backend_semantics": "Dispatch by assume_a: None=>auto-detect per-slice, General=>LU (dgesv), Symmetric=>Bunch-Kaufman (dsysv), PositiveDefinite=>Cholesky (dposv), Triangular=>dtrsv, Diagonal=>element-wise division, Banded=>dgbsv.",
      "strict_mode_behavior": "Match SciPy LAPACK selection logic exactly. Auto-detection checks diagonal, triangular, symmetric, positive-definite in order. overwrite_a=false by default (always copy). Return shape and dtype must exactly match SciPy.",
      "hardened_mode_behavior": "All inputs finite-checked regardless of check_finite flag. Condition number estimated before solve; if cond > 1e14, emit warning. Singular matrix detection is fail-closed: any zero pivot triggers error, no partial results returned. Auto-detection disabled in hardened mode (must specify assume_a explicitly or use General).",
      "invariants": [
        "output.shape == input_b.shape",
        "norm(A @ x - b) / norm(b) < rtol * cond(A) + atol for non-singular A",
        "empty input (N=0) returns empty output with matching shape",
        "singular matrix always raises SingularMatrix, never returns partial result",
        "dtype(output) == promote(dtype(a), dtype(b))"
      ],
      "performance_sentinel": "PERF-LINALG-SOLVE"
    },
    {
      "function_name": "fsci_linalg::solve_triangular",
      "scipy_equivalent": "scipy.linalg.solve_triangular",
      "inputs": [
        {
          "name": "a",
          "type_desc": "2D array f64 or c64, shape (M, M)",
          "required": true,
          "constraints": "Must be square. Only the specified triangle is read."
        },
        {
          "name": "b",
          "type_desc": "1D or 2D array f64 or c64, shape (M,) or (M, N)",
          "required": true,
          "constraints": "First dimension must match a."
        },
        {
          "name": "trans",
          "type_desc": "TransposeMode (NoTrans=0, Trans=1, ConjTrans=2)",
          "required": false,
          "default_value": "NoTrans",
          "constraints": "0/'N': Ax=b, 1/'T': A^Tx=b, 2/'C': A^Hx=b. ConjTrans equivalent to Trans for real matrices."
        },
        {
          "name": "lower",
          "type_desc": "bool",
          "required": false,
          "default_value": "false",
          "constraints": "If true, use lower triangle of a."
        },
        {
          "name": "unit_diagonal",
          "type_desc": "bool",
          "required": false,
          "default_value": "false",
          "constraints": "If true, assume diagonal elements are 1 (not referenced)."
        },
        {
          "name": "check_finite",
          "type_desc": "bool",
          "required": false,
          "default_value": "true",
          "constraints": "When true, reject NaN/Inf inputs."
        }
      ],
      "outputs": [
        {
          "name": "x",
          "type_desc": "Array f64 or c64, same shape as b",
          "semantics": "Solution to triangular system. Shape matches b."
        }
      ],
      "error_conditions": [
        {
          "condition": "a is not square",
          "error_type": "InvalidShape",
          "message_pattern": "expected square matrix",
          "scipy_behavior": "ValueError: expected square matrix"
        },
        {
          "condition": "dimension mismatch between a and b",
          "error_type": "IncompatibleShape",
          "message_pattern": "incompatible dimensions",
          "scipy_behavior": "ValueError: incompatible dimensions"
        },
        {
          "condition": "zero on diagonal (singular triangular) when unit_diagonal=false",
          "error_type": "SingularMatrix",
          "message_pattern": "singular matrix",
          "scipy_behavior": "LinAlgError: singular matrix"
        },
        {
          "condition": "check_finite=true and input contains NaN or Inf",
          "error_type": "NonFiniteInput",
          "message_pattern": "input contains non-finite values",
          "scipy_behavior": "ValueError: array must not contain infs or NaNs"
        }
      ],
      "tolerance_policy": {
        "comparison_mode": "mixed",
        "default_atol": 1e-13,
        "default_rtol": 1e-9,
        "notes": "Triangular solve is backward-stable. Expected residual norm proportional to cond_triangle(A) * eps."
      },
      "backend_semantics": "LAPACK dtrtrs for all cases. trans parameter maps directly to LAPACK TRANS argument.",
      "strict_mode_behavior": "Off-triangle elements silently ignored (only specified triangle read). unit_diagonal=true means diagonal never referenced, no singularity check on diagonal. trans=2 with real input treated as trans=1.",
      "hardened_mode_behavior": "Finite-check all inputs regardless of flag. Diagonal elements checked for near-zero (|d_ii| < eps * norm(a)) with warning. When unit_diagonal=false and any |d_ii| < macheps, emit ill-conditioned warning before proceeding.",
      "invariants": [
        "output.shape == input_b.shape",
        "only triangle specified by lower flag is accessed from a",
        "unit_diagonal=true implies diagonal of a is never read",
        "trans=2 with real input is equivalent to trans=1"
      ],
      "performance_sentinel": "PERF-LINALG-SOLVE-TRI"
    },
    {
      "function_name": "fsci_linalg::solve_banded",
      "scipy_equivalent": "scipy.linalg.solve_banded",
      "inputs": [
        {
          "name": "l_and_u",
          "type_desc": "(usize, usize)",
          "required": true,
          "constraints": "Tuple (l, u) where l = number of non-zero lower diagonals, u = number of non-zero upper diagonals. Both >= 0."
        },
        {
          "name": "ab",
          "type_desc": "2D array f64 or c64, shape (l+u+1, M)",
          "required": true,